,rank,uri,artist_names,track_name,source,peak_rank,previous_rank,weeks_on_chart,streams,week,country
0,1,spotify:track:6Ajvu1afirjocbZK934qqh,"Simba La Rue, Tony Boy, FT Kings",AYAHUASCA (feat. Tony Boy),Warner Music,1,-1,1,2883089,1,Italy
1,2,spotify:track:2DkiFEQ1ihXcYKaIRsfGFp,Marracash,LEI,Universal Music Italia srL.,1,1,4,2561363,1,Italy
2,3,spotify:track:62OO2X47vPk5WxTx68HDqg,"Artie 5ive, Niky Savage",BAMBOLA (feat. Niky Savage),Warner Music,2,2,4,2318847,1,Italy
3,4,spotify:track:4X4R6qsIicxIQIFbnDcJLO,"Olly, Juli",Scarabocchi,Epic,4,4,11,2125314,1,Italy
4,5,spotify:track:41lOxc6ARYZPXpKeMWcHsD,Pinguini Tattici Nucleari,Islanda,Epic,1,3,8,2120888,1,Italy
5,6,spotify:track:2L16IuIQgLL1HupWGN4F4t,Cesare Cremonini,Ora che non ho più te,Universal Music Italia srL.,1,5,16,1977553,1,Italy
6,7,spotify:track:1QcmAp6Ev2HuYxKujUwnw0,Alfa,il filo rosso,Artist First,2,6,12,1892424,1,Italy
7,8,spotify:track:4MtjrbmBKdYRMTyEHqOUmM,Marracash,GLI SBANDATI HANNO PERSO,Universal Music Italia srL.,2,8,4,1858925,1,Italy
8,9,spotify:track:5nFyfjGy6AMZqkW0OMUWJJ,"Olly, Angelina Mango, Juli",Per due come noi,Epic,1,7,18,1694591,1,Italy
9,10,spotify:track:00URgxWgyVoybGLhhmKr7g,"Baby Gang, Omega, Higashi, Roberto Ferrante",Tu Me Quieres - Prod. by Higashi x Roberto Ferrante,Baby Gang / Planet Records [Powered by Planet Distribution],10,10,17,1665436,1,Italy
10,11,spotify:track:2O8jjjtyEfXliQ6vdtdPvH,"Papa V, Nerissima Serpe, Fritu",Tip Tap,UNIKAL,3,9,6,1549794,1,Italy
11,12,spotify:track:4wJ5Qq0jBN4ajy7ouZIV1c,"ROSÉ, Bruno Mars",APT.,Atlantic Records,12,14,12,1517149,1,Italy
12,13,spotify:track:3yFgWoossjlaJ919XDCG4C,"Simba La Rue, FT Kings, Sick Luke",MI PIACCIONO LE ARMI,Warner Music,1,11,12,1448859,1,Italy
13,14,spotify:track:3XOcMFFT6Oo2ZCXLJ9lqdT,"Geolier, Rose Villain, Poison Beatz",TU ED IO (feat. Rose Villain),Warner Music,8,12,7,1399281,1,Italy
14,15,spotify:track:75Y6WgUldQN8mipAVLy8KJ,"Olly, Juli",Quei ricordi là,Epic,15,21,11,1263088,1,Italy
15,16,spotify:track:1ej2NcW0CHnscPp1RZpr1V,"Olly, Juli",Devastante,Epic,9,16,44,1262291,1,Italy
16,17,spotify:track:1GVDt0vn0wJ1QemPfMEWTU,Ghali,Niente Panico,Warner Music,16,19,13,1260849,1,Italy
17,18,spotify:track:5MJc4IVIt17xEt6angtZcq,Lazza,BUIO DAVANTI,Universal Music Italia srL.,8,29,16,1247258,1,Italy
18,19,spotify:track:7sj9VfVtmcEZBDbRAsVXWY,"ANNA, Niky Savage",TT LE GIRLZ (feat. Niky Savage),Universal Music Italia srL.,1,15,28,1204296,1,Italy
19,20,spotify:track:2plbrEY59IikOBgBGLjaoe,"Lady Gaga, Bruno Mars",Die With A Smile,Interscope,20,20,21,1202795,1,Italy
20,21,spotify:track:1nLGeFQuY7PFxrou3ezEvP,Sal Da Vinci,Rossetto e caffè,Cose Production srl,10,18,26,1170832,1,Italy
21,22,spotify:track:2gI2IA7QGtzKZKuahon3W1,Achille Lauro,Amore Disperato,Warner Music,5,13,16,1158717,1,Italy
22,23,spotify:track:7ne4VBA60CxGM75vw0EYad,Gracie Abrams,That’s So True,"Gracie Abrams, under exclusive license to Interscope Records",23,31,9,1121764,1,Italy
23,24,spotify:track:6hBvXhUosokAqnc701pVE1,Marracash,È FINITA LA PACE,Universal Music Italia srL.,3,17,4,1081435,1,Italy
24,25,spotify:track:3OewdIjWctx4TH6jswXRrc,Pinguini Tattici Nucleari,Amaro,Epic,11,23,5,1046558,1,Italy
25,26,spotify:track:1IkzT4wzFJRbFOmKOSqTen,"Geolier, Takagi & Ketra, Dat Boi Dee",EPISODIO D'AMORE,Warner Music,7,26,31,1037350,1,Italy
26,27,spotify:track:6WatFBLVB0x077xWeoVc2k,KAROL G,Si Antes Te Hubiera Conocido,Bichota/Interscope Records,5,27,28,970413,1,Italy
27,28,spotify:track:6d9eOuVkzV4XJ8YIWM3Q1k,"Tony Effe, Kid Yugi, Sick Luke",PEZZI DA 100 (feat. Kid Yugi),Universal Music Italia srL.,22,22,5,965525,1,Italy
28,29,spotify:track:0CCWIksRK4Q3um834dNG3a,Pinguini Tattici Nucleari,Romantico Ma Muori,Epic,7,30,17,922025,1,Italy
29,30,spotify:track:0wHW7nZlqZqbxnmTotTLGp,Marracash,POWER SLAP,Universal Music Italia srL.,1,25,4,908377,1,Italy
30,31,spotify:track:2z9FUHRkbkV4BObNzbHsFU,Damiano David,Born With a Broken Heart,Sony Music Italy / Arista Records,31,39,11,883200,1,Italy
31,32,spotify:track:0GFkLnsRGqtkd23dFWpoI0,"Lele Blade, Geolier, Dele, Poison Beatz",HEETS (feat. Geolier),Warner Music,5,32,11,867299,1,Italy
32,33,spotify:track:4ZRVI6xwgbjgW5SgJB468n,"ANNA, Artie 5ive",I LOVE IT (feat. Artie 5ive),Universal Music Italia srL.,3,28,28,851530,1,Italy
33,34,spotify:track:19DHPlTC2gx1j4jrFzNbwL,ANNA,30ºC,Universal Music Italia srL.,1,24,32,847372,1,Italy
34,35,spotify:track:6MQYhSIrh9vwztmM6mwkzQ,"Kid Yugi, Night Skinny, Artie 5ive",Porto il Commerciale (feat. Artie 5ive),Universal Music Italia srL.,35,38,40,839490,1,Italy
35,36,spotify:track:5EPfp1edrw1vgxriqxLTlD,RRARI DAL TACCO,CAFFÈ AMARO,Universal Music Italia srL.,36,61,5,829023,1,Italy
36,37,spotify:track:7BeZyW4hVjeCocSLwDrCME,"Geolier, Michelangelo","I P’ ME, TU P’ TE",Warner Music,1,36,49,823533,1,Italy
37,38,spotify:track:13wkp4Ph4UNAVPwf9B04l8,Marracash,VITTIMA,Universal Music Italia srL.,6,33,4,811478,1,Italy
38,39,spotify:track:6dOtVTDdiauQNBQEDOtlAB,Billie Eilish,BIRDS OF A FEATHER,Darkroom/Interscope Records,39,51,34,772050,1,Italy
39,40,spotify:track:30yZdVYOfemHG7uuntz7HH,ANNA,TONIGHT,Universal Music Italia srL.,30,42,28,771064,1,Italy
40,41,spotify:track:5HWWpSsNnlc2Kyh5QLrq1W,Tananai,RAGNI,Universal Music Italia srL.,16,49,18,765104,1,Italy
41,42,spotify:track:3o9OeBX0vgh51r15Ta7Dok,"CoCo, Geolier, Startuffo, D-Ross",Video hot (feat. Geolier),Warner Music,15,40,9,757570,1,Italy
42,43,spotify:track:3EJSUFQGUaTm4Km2Zri1Zp,"Juli, Emma, Olly",HO VOGLIA DI TE,Universal Music Italia srL.,15,45,30,733725,1,Italy
43,44,spotify:track:3zjwZqLebYTDvRS2RJH5Be,"ANNA, Sillyelly",HELLO KITTY (feat. Sillyelly),Universal Music Italia srL.,15,35,28,733577,1,Italy
44,45,spotify:track:6OCnAtM8oa0JymErlTYXxG,"Astro, ANNA",1 MOMENTO (feat. ANNA),Warner Music,6,37,14,719174,1,Italy
45,46,spotify:track:42wdz3j7gstgUuhoFLCXqd,FloyyMenor,PELIGROSA,FloyyMenor under exclusive license to UnitedMasters LLC,41,48,20,714708,1,Italy
46,47,spotify:track:2wpSLqGcN5KXVeAGdAnQd0,"Ornella Vanoni, Jack Sani",Sant'allegria - Jack Sani Remix,NAR International,34,34,20,714482,1,Italy
47,48,spotify:track:5EeDZPNPIjEtEZsHMkX1m7,Kid Yugi,Donna,Universal Music Italia srL.,3,83,11,694148,1,Italy
48,49,spotify:track:3Npk1eTTxSkRNYet4PW2yY,"thasup, Mara Sattei",POSTO MIO,Thasup s.r.l.,27,53,4,685626,1,Italy
49,50,spotify:track:4ObR0HIDnDfycaxGTALioH,"Geolier, Dat Boi Dee",CHE SOLE OGGI,Warner Music,15,77,7,684136,1,Italy
50,51,spotify:track:1zp4TEQ9zaNGXTjY6fsz1p,"Capo Plaza, ANNA",Soldi Arrotolati (feat. ANNA),Warner Music,5,44,36,678449,1,Italy
51,52,spotify:track:1A1xTBtNnJ09JNINiLjdOK,Ultimo,ALTROVE,Ultimo Records,19,54,35,673210,1,Italy
52,53,spotify:track:2l4NKSQbBA3sV0nxpNjSkj,Lazza,100 MESSAGGI,Universal Music Italia srL.,1,78,46,661421,1,Italy
53,54,spotify:track:4Y60H8heDsEpQ2hin2g6V5,Don Pero,Baby Mama,Pulp Entertainment,22,52,98,654761,1,Italy
54,55,spotify:track:347HJzwbn0cmrxJUmAXj5c,"Geolier, Dardust",MAI PER SEMPRE,Warner Music,9,46,8,648335,1,Italy
55,56,spotify:track:6bN41HjY008ggroMFxNLaa,"Sfera Ebbasta, Geolier, Simba La Rue, Baby Gang",Calcolatrici,Universal Music Italia srL.,1,80,60,632756,1,Italy
56,57,spotify:track:3bQBpGIlToMHfyKtKZwOyN,Marracash,DETOX / REHAB,Universal Music Italia srL.,7,43,4,630700,1,Italy
57,58,spotify:track:69VAE3LA7jn5rGAsdflMOS,"Geolier, Poison Beatz",EL PIBE DE ORO,Warner Music,5,82,35,630194,1,Italy
58,59,spotify:track:0ryO2qGJlJU1CYCqIWuTw7,Gazzelle,Noi no,Warner Music,59,-1,1,619346,1,Italy
59,60,spotify:track:7dYgUWAIXFUniq5S2OkDZC,ANNA,WHY U MAD,Universal Music Italia srL.,55,55,7,619232,1,Italy
60,61,spotify:track:4Pd8GRxfNPqKWi2NLtvQ03,Nabi,Calibro,Warner Music,61,121,6,618539,1,Italy
61,62,spotify:track:3pR6j5Zhl7Qbrv4lh3DTG5,"Tony Effe, Gaia",SESSO E SAMBA (feat. Gaia),Universal Music Italia srL.,1,47,33,618016,1,Italy
62,63,spotify:track:2fgOUiGsgelBOjH8ZTSJHs,"Tony Boy, ANNA",Codeine (feat. ANNA),Warner Music,34,63,5,614075,1,Italy
63,64,spotify:track:55aJJZPGLrIjI0nYYb7Bul,"Lazza, Lil Baby",CANZONE D'ODIO (feat. Lil Baby),Universal Music Italia srL.,1,91,16,608909,1,Italy
64,65,spotify:track:62UEDjQEgBx7GDKDiSoz3i,Tananai,BOOSTER,Universal Music Italia srL.,65,96,9,608522,1,Italy
65,66,spotify:track:0HiHVL8iC1Z1kAjV6vZdIo,"Tony Boy, Frah Quintale, Capo Plaza","Non mi basta mai (feat. Frah Quintale, Capo Plaza)",Warner Music,13,68,5,604524,1,Italy
66,67,spotify:track:1NgWfYWI2bzBjBI0TsxvWU,"Sick Luke, Izi",SENZA TEMPO (feat. Izi),Carosello Records,67,-1,1,602056,1,Italy
67,68,spotify:track:4ySxBjhmdnkeFUqhKxW3cY,Sfera Ebbasta,Visiera A Becco,Universal Music Italia srL.,43,64,205,601937,1,Italy
68,69,spotify:track:79wDKThuLEgiQwJ0onVs3s,"Tony Boy, Shiva",Perdono (feat. Shiva),Warner Music,7,56,5,599908,1,Italy
69,70,spotify:track:5JgTIfS7FfSE9tuebzX8HC,"Night Skinny, Nerissima Serpe, Papa V",Tessera sanitaria (feat. Nerissima Serpe & Papa V),Universal Music Italia srL.,7,60,13,594934,1,Italy
70,71,spotify:track:5LDmD4cFF0C8BCf3tVvyBW,"Tedua, Annalisa",Beatrice (feat. Annalisa),Epic,1,67,33,591601,1,Italy
71,72,spotify:track:05wb6MEyJeG2z1MVCIXxC8,"Sfera Ebbasta, Marracash",15 Piani,Universal Music Italia srL.,1,81,60,591095,1,Italy
72,73,spotify:track:0xEgDBXYO9gGzmxCFWKxNg,Marracash,CRUDELIA - I nervi,Universal Music Italia srL.,2,88,260,588045,1,Italy
73,74,spotify:track:0Op5iGBVLyY0G1lDDRfEnf,Marracash,CRASH,Universal Music Italia srL.,5,50,4,579543,1,Italy
74,75,spotify:track:7MMJa7cjMadOSR6CFWvB1x,Coez,La musica non c'è,Warner Music,1,87,252,574320,1,Italy
75,76,spotify:track:0mEyPi2ya8h8632gp9XmmQ,"Night Skinny, Tony Boy, Kid Yugi, Capo Plaza","Entro nel posto (feat. Tony Boy, Kid Yugi & Capo Plaza)",Universal Music Italia srL.,1,76,13,570167,1,Italy
76,77,spotify:track:3WS0TcakSQfE0t1fFTQwDW,Marracash,PENTOTHAL,Universal Music Italia srL.,13,62,4,569210,1,Italy
77,78,spotify:track:2ceJa7d62wQ3eRBK589ALG,"Shiva, Kid Yugi",Gotham (feat. Kid Yugi),Milano Ovest,2,57,18,569134,1,Italy
78,79,spotify:track:0U2mw5WWH5LmeqHl59uWUh,"Simba La Rue, FT Kings",VRP,Warner Music,24,41,15,565696,1,Italy
79,80,spotify:track:1tIGa9fXqu3T3AikU5G8Ds,"Geolier, Michelangelo",PER SEMPRE,Warner Music,26,65,31,564631,1,Italy
80,81,spotify:track:2262bWmqomIaJXwCRHr13j,Gigi Perez,Sailor Song,Gigi Perez PS/ Island,81,89,13,561881,1,Italy
81,82,spotify:track:7nRFsITVaSHko2Fw2Gcy59,Gazzelle,Destri,Artist First / Maciste Dischi,2,95,224,559167,1,Italy
82,83,spotify:track:5omIW7YOPhA6CULhkdz6jE,"Tedua, Baby Gang, Kid Yugi",Paradiso Artificiale (feat. Baby Gang & Kid Yugi),Epic,2,66,84,554510,1,Italy
83,84,spotify:track:0ngRr9jrwrd4bhltVSHTEb,Marracash,SOLI,Universal Music Italia srL.,9,58,4,548177,1,Italy
84,85,spotify:track:3X5Zw8zkIGULZEnJUwwJwj,Glocky,Problem Solver,Square,85,138,2,548038,1,Italy
85,86,spotify:track:4I2SWtTgB08SICbqN6983B,"ANNA, Lazza",BBE (feat. Lazza),Universal Music Italia srL.,4,73,35,544563,1,Italy
86,87,spotify:track:7KTseTI8UdMT4WUIOmjTQC,"TY1, Kid Yugi, Nerissima Serpe","MONOPOLIO (feat. Kid Yugi, Nerissima Serpe)",Thaurus,85,85,49,542299,1,Italy
87,88,spotify:track:0qeIFEGRQqHoaJtLCl0U73,"Myke Towers, benny blanco",DEGENERE 👑 (feat. benny blanco),WEA Latina,72,72,9,536561,1,Italy
88,89,spotify:track:1Es7AUAhQvapIcoh3qMKDL,"The Weeknd, Playboi Carti",Timeless (feat Playboi Carti),XO / Republic Records,50,106,15,533814,1,Italy
89,90,spotify:track:0lXVWzLwDnKB7Ro5p0AJPg,"Rose Villain, Guè",COME UN TUONO (feat. Guè),Warner Music,1,71,44,532596,1,Italy
90,91,spotify:track:1yZIX0bRGjVH6CqyUW8Dkw,"Tananai, Annalisa",STORIE BREVI,Universal Music Italia srL.,5,84,31,531285,1,Italy
91,92,spotify:track:3Fg8eOwcv5ctsjYYajBzFk,"Capo Plaza, Shiva",Nuovo Inizio (feat. Shiva),Warner Music,13,140,8,528317,1,Italy
92,93,spotify:track:5oJVfPUHsD7A8bZtKVqgL2,"Geolier, Ultimo, Takagi & Ketra",L'ULTIMA POESIA (feat. Ultimo),Warner Music,2,59,42,528051,1,Italy
93,94,spotify:track:2esZG2XFtuoWWA9AfDvSxy,"FloyyMenor, Cris Mj",Gata Only,FloyyMenor under exclusive license to UnitedMasters LLC,2,69,44,527717,1,Italy
94,95,spotify:track:3bXpBkWuxmutEWvTqAIdaz,Coma_Cose,POSTI VUOTI,Warner Music,95,114,4,525577,1,Italy
95,96,spotify:track:7fH13hSOyNoeiDGbjEnTUC,"Guè, Marracash",Brivido,Universal Music Italia srL.,73,128,251,523939,1,Italy
96,97,spotify:track:5Tte5M4saQ25z2ZI83wgYU,"Le-one, Christian Liguori, Babywyne",NUN È OVER,Epic,28,75,13,522394,1,Italy
97,98,spotify:track:14siwDD1osf77j5kwQnlQ4,Marracash,FACTOTUM,Universal Music Italia srL.,16,79,4,515876,1,Italy
98,99,spotify:track:3ppXueOTvYpYp7zQUbuIKh,"Shiva, Tony Boy",Polvere (feat. Tony Boy),Milano Ovest,9,103,18,505148,1,Italy
99,100,spotify:track:1CGqE43Inhm54oPCMrgF7S,SETTEMBRE,VERTEBRE,Isola degli Artisti,66,92,7,504090,1,Italy
100,101,spotify:track:7KI9vyPycMZ0Noh51ylQ9W,"Night Skinny, Artie 5ive, Capo Plaza, Tony Effe","Nella trap (feat. Artie 5ive, Capo Plaza & Tony Effe)",Universal Music Italia srL.,6,100,13,503052,1,Italy
101,102,spotify:track:6YB8rH5Lr340A4ps8eV7hw,Kid Yugi,Lilith,Universal Music Italia srL.,8,105,45,498337,1,Italy
102,103,spotify:track:7jfthjlyognNdV2geSbtsE,Capo Plaza,Borse Hermès,Warner Music,46,108,11,495848,1,Italy
103,104,spotify:track:3qtuOAI0YyfoBM1s7Tvm46,Cesare Cremonini,La Nuova Stella Di Broadway,Universal Music Italia srL.,68,104,85,494940,1,Italy
104,105,spotify:track:2fwe8oxvNUUvvEDAth54jN,"Elodie, Tiziano Ferro",Feeling,Universal Music Italia srL.,23,125,9,492651,1,Italy
105,106,spotify:track:5pYy054Wcuj9CFdDIxZSVU,"Olly, Juli",Menomale che c'è il mare,Epic,106,131,20,490348,1,Italy
106,107,spotify:track:5LZVK19ieaV8Mk9FsqTL3F,Pinguini Tattici Nucleari,Ridere,RCA Records Label,31,117,248,486382,1,Italy
107,108,spotify:track:5eSC7faDYHxnklPjcxZjD6,Marracash,BRAVI A CADERE - I polmoni,Universal Music Italia srL.,8,178,91,485298,1,Italy
108,109,spotify:track:7kktKNHgINrBczPUGoG38p,Sfera Ebbasta,Bang Bang,Universal Music Italia srL.,57,122,130,484255,1,Italy
109,110,spotify:track:1BJJbSX6muJVF2AK7uH1x4,"Adam Port, Stryv, Keinemusik, Orso, Malachiii",Move,Keinemusik,18,93,30,484198,1,Italy
110,111,spotify:track:2wriIDkmJi8ouCfNi985KT,ANNA,UNA TIPA COME ME,Universal Music Italia srL.,64,74,28,481525,1,Italy
111,112,spotify:track:0sHrLJSJjXgYfylCXqXjGN,Rondodasosa,GHETTO,Warner Music,112,-1,1,480493,1,Italy
112,113,spotify:track:35ISBknsCeZQtq66xABI9g,Lola Young,Messy,Universal-Island Records Ltd.,113,-1,1,479362,1,Italy
113,114,spotify:track:49mN8ph1LK58r7TMYW1Srb,"Fred De Palma, Rose Villain",MMH (feat. Rose Villain),Warner Music,77,112,12,476646,1,Italy
114,115,spotify:track:07qo9gnLM488CUr0EtgIA1,Cesare Cremonini,Poetica,Universal Music Italia srL.,15,137,56,472427,1,Italy
115,116,spotify:track:3w73qvCSGWPCx7w1UMIh6e,Capo Plaza,Lo So Che,Warner Music,34,182,7,471296,1,Italy
116,117,spotify:track:0sZ7ORHX2NHuIQZjpX0Te4,"Night Skinny, Tony Boy, anice, Geolier, Shiva","Solo Dio sa (feat. Tony Boy, anice, Geolier & Shiva)",Universal Music Italia srL.,5,101,13,470321,1,Italy
117,118,spotify:track:7tI8dRuH2Yc6RuoTjxo4dU,Jimin,Who,BIGHIT MUSIC,92,107,24,469583,1,Italy
118,119,spotify:track:0WbMK4wrZ1wFSty9F7FCgu,Chappell Roan,"Good Luck, Babe!",Chappell Roan PS/ Island,116,130,19,467062,1,Italy
119,120,spotify:track:4z9xPVz2Sii4dhM7yhxOpj,"Geolier, Sfera Ebbasta, Dardust",IO T’O GIUR’ (feat. Sfera Ebbasta),Warner Music,7,154,30,467027,1,Italy
120,121,spotify:track:1CJNj8Qnpoz6lyil9EgqfE,"Astro, Simba La Rue",SPENDERE (feat. Simba La Rue),Warner Music,10,97,14,464207,1,Italy
121,122,spotify:track:29nqe5lhK8JmNcVXum7UuA,"Kid Yugi, Tedua, Junior K",Eva (feat. Tedua),Universal Music Italia srL.,3,98,45,462318,1,Italy
122,123,spotify:track:0bKDQionn4VKcgNKbs4SWX,Pinguini Tattici Nucleari,Pastello Bianco,RCA Records Label,2,150,139,462224,1,Italy
123,124,spotify:track:0p4TRJB0KEBaeC5yBwLzNL,"Shiva, Paky",Digos,Milano Ovest,47,86,3,460063,1,Italy
124,125,spotify:track:1jM7qLKYebmZhnjwl2MpTo,"Papa V, Nerissima Serpe, Fritu",Apparecchiato (feat. Nerissima Serpe),Columbia,96,109,23,459917,1,Italy
125,126,spotify:track:5nqOdSrqurNq8ejE7Ujc9l,Kid Yugi,Il Filmografo,Universal Music Italia srL.,97,145,32,458492,1,Italy
126,127,spotify:track:3NLdcu14EPntcZIn3mxSR7,"Kid Yugi, Night Skinny, Tony Boy",Sintetico (feat. Tony Boy),Universal Music Italia srL.,76,127,64,455648,1,Italy
127,128,spotify:track:76VxwttPNesap8xfdDn8tG,"Glocky, Faneto",MOLLY ROSA,Square / Trenches Records Ent,128,158,4,453798,1,Italy
128,129,spotify:track:4elAiEgBssziHLfCrBoEA2,"Cesare Cremonini, Luca Carboni",San Luca (feat. Luca Carboni),Universal Music Italia srL.,54,136,6,450623,1,Italy
129,130,spotify:track:3KqIOF2HTFEwz0HmErwOYG,"Lazza, Sfera Ebbasta",FENTANYL (feat. Sfera Ebbasta),Universal Music Italia srL.,1,171,15,450154,1,Italy
130,131,spotify:track:1JSTJqkT5qHq8MDJnJbRE1,The Police,Every Breath You Take,Polydor Records,120,120,7,449831,1,Italy
131,132,spotify:track:0Okgqls9nKLzgnQGL9HGVL,"Simba La Rue, FT Kings",40 GRADI,Warner Music,33,135,18,446970,1,Italy
132,133,spotify:track:7115pIZRP1L0MaJCPFPPFM,Tony Boy,Come mi guardi,Gorilla Records,102,165,17,446486,1,Italy
133,134,spotify:track:2xjxaKiYssIdDU6DCPpZPt,Dark Polo Gang,Cambiare Adesso,Universal Music Italia srL.,1,123,67,444114,1,Italy
134,135,spotify:track:6RJW9DiBr1RDjgT4GdCSp7,"Geolier, Dat Boi Dee, ROOM9","FERRARI (from ""Uonderbois"")",Warner Music,135,-1,2,442272,1,Italy
135,136,spotify:track:6T0QOCB2vNIBHlw5OZiyah,Tony Boy,Il tempo cura,Warner Music,10,167,17,437810,1,Italy
136,137,spotify:track:74cyFjvgjyiFiQ3QxszFWq,Tananai,TANGO,Universal Music Italia srL.,3,144,98,434217,1,Italy
137,138,spotify:track:1HCwbTHBvC4XCIC417NB5k,Rose Villain,CLICK BOOM!,Warner Music,7,99,49,433797,1,Italy
138,139,spotify:track:3qxiSQOe8EhQm7OckqKiUu,"Tony Effe, Bresh, Tedua",DOPO LE 4 (feat. Bresh & Tedua),Universal Music Italia srL.,1,139,43,431267,1,Italy
139,140,spotify:track:2vrIP2Q50rshudyAuMmw5O,"Night Skinny, Low-Red, Kid Yugi, Tony Boy, Papa V, Nerissima Serpe, Artie 5ive, Astro","Players Club '24 (feat. Low-Red, Tony Boy, Papa V, Nerissima Serpe, Artie 5ive, Kid Yugi, Astro)",Universal Music Italia srL.,46,102,3,429123,1,Italy
140,141,spotify:track:50okpBf3MvXr4FyWB6jJIK,Bresh,Torcida,Epic,12,124,35,424493,1,Italy
141,142,spotify:track:1j7NJW5M4YLFbXFa8kFBaS,Marracash,MI SONO INNAMORATO DI UN AI,Universal Music Italia srL.,15,94,4,424040,1,Italy
142,143,spotify:track:2YdOZTN2ElEYhEuq6zmwT8,Gazzelle,Non sei tu,Maciste Dischi,141,195,43,422037,1,Italy
143,144,spotify:track:62ZLW8EAtHRXAEsCCgVaVV,LIBERATO,TURNÀ,LIBERATO,144,-1,1,417282,1,Italy
144,145,spotify:track:5Gup6xk94HJp2bYANhJsoS,"Geolier, Yung Snapp, Murad",500K,Warner Music,18,170,7,415586,1,Italy
145,146,spotify:track:1LcAwUvsiWJqTgV9vDs0oq,"Kid Yugi, Sfera Ebbasta, Shablo",Ex Angelo (feat. Sfera Ebbasta),Universal Music Italia srL.,10,166,41,415109,1,Italy
146,147,spotify:track:1yKRalWLlHie0zbKW3n6W0,Alfa,vai!,Artist First,9,110,39,414752,1,Italy
147,148,spotify:track:1N7cE9RdKR5FRkB9cxsjH4,"Low-Red, Yung Snapp",BISEX (feat. Yung Snapp),Universal Music Italia srL.,148,174,2,412535,1,Italy
148,149,spotify:track:3xkHsmpQCBMytMJNiDf3Ii,Benson Boone,Beautiful Things,"Night Street Records, Inc./Warner Records Inc.",19,90,50,409274,1,Italy
149,150,spotify:track:7uu3YZytpYW15VIfa7ynJk,"Marracash, Federica Abbate",Niente Canzoni D'Amore - Inedito,Universal Music Italia srL.,137,191,23,407987,1,Italy
150,151,spotify:track:40L4vT3sk7YxFaWLItE3df,Marracash,HAPPY END,Universal Music Italia srL.,19,113,4,407715,1,Italy
151,152,spotify:track:0kcXZMVoH1q923xLM9OKf6,Elodie,Black Nirvana,Universal Music Italia srL.,10,129,30,407052,1,Italy
152,153,spotify:track:2HRqTpkrJO5ggZyyK6NPWz,Sabrina Carpenter,Espresso,Island Records,30,143,36,404833,1,Italy
153,154,spotify:track:6s5DJ2zRf9T3A2VidCCHxZ,"Geolier, Dat Boi Dee, Poison Beatz, Geenaro & Ghana Beats",SI STAT’ TU,Warner Music,15,119,31,403164,1,Italy
154,155,spotify:track:3PYYiqmhooCNCGiiPTM5zS,"Elisa, Calcutta ",Se Piovesse Il Tuo Nome - con Calcutta,Universal Music Italia srL.,60,198,32,400203,1,Italy
155,156,spotify:track:1syS5FwTeSz4MbJLT9Oxaj,"Lazza, Marracash",-3 (PERDERE IL VOLO) (feat. Marracash),Universal Music Italia srL.,5,-1,14,400149,1,Italy
156,157,spotify:track:0mHC3BK9vFGoEU0EcGPWRZ,Lazza,CENERE,Universal Music Italia srL.,1,184,90,400028,1,Italy
157,158,spotify:track:0gkV0FyCdrJqwyrFW7NsEQ,883,Come mai,WM Italy,83,159,10,398440,1,Italy
158,159,spotify:track:1xiCaiy7CFnymZvf80ZKBk,Pinguini Tattici Nucleari,Burnout,Epic,31,111,5,398224,1,Italy
159,160,spotify:track:0Sr7ssScx54yxdM2ols7nW,"Omar Courtz, De La Rose",Q U E V A S H A C E R H O Y ?,Mr. 305 Records / Rimas Entertainment,94,146,13,397565,1,Italy
160,161,spotify:track:5zVQoMHyELfcHYviXDao3I,"Artie 5ive, Guè",MILANO TESTAROSSA (feat. Guè),Warner Music,23,156,23,390740,1,Italy
161,162,spotify:track:0liQcHfCU5zKeSEdIYfGIP,"Holden, mew",GRANDINE (feat. mew),Latarma S.r.l.,40,148,9,389442,1,Italy
162,163,spotify:track:60QN1JrgYM7jcfW8pdQFqT,Annalisa,Sinceramente,Warner Music,3,142,41,388928,1,Italy
163,164,spotify:track:0YmbCvOH82KPkFVK3qBaAD,Mahmood,TUTA GOLD,Universal Music Italia srL.,1,133,43,387862,1,Italy
164,165,spotify:track:2toyDDWentmjZTyojLVXfP,"Olly, Juli",I cantieri del Giappone,Epic,76,175,5,387535,1,Italy
165,166,spotify:track:1cAM8Azcg1TPzm4ek7J3RZ,Gazzelle,Come il pane,Warner Music,32,-1,4,387072,1,Italy
166,167,spotify:track:3sdvDRHwSpuKUehwVYxHcG,Shiva,Take 5,Milano Ovest,3,151,20,385972,1,Italy
167,168,spotify:track:05mlLQhbyQ9CCdtIt4jHVS,Enrico Nigiotti,Tu sei per me,Columbia,128,149,5,382863,1,Italy
168,169,spotify:track:3sVyYDKJ5vhzn6ryEcaGHt,"Rhove, ANNA",Petit Fou Fou (feat. ANNA),Universal Music Italia srL.,3,126,47,381451,1,Italy
169,170,spotify:track:3Vr3zh0r7ALn8VLqCiRR10,Myles Smith,Stargazing,RCA Records Label,51,176,29,380709,1,Italy
170,171,spotify:track:2SEAbXqFtdTwkzgAb5Ci80,"Kid Yugi, Simba La Rue",Denaro (feat. Simba La Rue),Universal Music Italia srL.,11,172,42,380315,1,Italy
171,172,spotify:track:5WssaPhjCCUFBMk9PpnHYj,"Sfera Ebbasta, Elodie",Anche Stasera,Universal Music Italia srL.,5,164,59,376950,1,Italy
172,173,spotify:track:1odrZy5kTuj3SGdfgzhMzq,"Night Skinny, Luchè",Scale (con Luchè),Universal Music Italia srL.,28,185,33,375372,1,Italy
173,174,spotify:track:5z1XCZMzScqeqCe4iUh3WA,Tony Boy,Tutti i giorni,Warner Music,25,-1,3,374770,1,Italy
174,175,spotify:track:0cDq1fpfr9NNFNAKQXLLK7,"Alessandra Amoroso, BigMama",Mezzo Rotto (feat. BigMama),Epic,14,163,31,374019,1,Italy
175,176,spotify:track:1mea3bSkSGXuIRvnydlB5b,Coldplay,Viva La Vida,Parlophone UK,72,-1,22,372587,1,Italy
176,177,spotify:track:3cGuiySfwJPXqvE15OiEEg,Sfera Ebbasta,Tran Tran,Universal Music Italia srL.,1,147,166,372287,1,Italy
177,178,spotify:track:0MLu1cFYL4ikdRTdasCQT9,"Shablo, Geolier, Sfera Ebbasta",M' Manc (con Geolier & Sfera Ebbasta),Universal Music Italia srL.,1,180,193,371060,1,Italy
178,179,spotify:track:5TFD2bmFKGhoCRbX61nXY5,Bad Bunny,NUEVAYoL,Rimas Entertainment LLC.,179,-1,1,371048,1,Italy
179,180,spotify:track:3hRV0jL3vUpRrcy398teAU,Lord Huron,The Night We Met,Play It Again Sam,85,190,47,369370,1,Italy
180,181,spotify:track:7kS2AVRk5Yj6BTj8PyJFfC,Ghali,Paprika,Warner Music,2,132,35,368390,1,Italy
181,182,spotify:track:5BqUbKq9rCMrCkRtAiz8XA,Il Pagante,Settimana Bianca,Il Pagante,98,134,50,368030,1,Italy
182,183,spotify:track:2EBlqIr8yZLUqTiWtB9Tgo,Tony Boy,Stanza,Warner Music,23,179,5,366623,1,Italy
183,184,spotify:track:0Sp6AOrAlVmKRIzmQGjLS8,"Gheba, Pave",Boxer,Universal Music Italia srL.,181,181,2,366575,1,Italy
184,185,spotify:track:6Eh1Pg18WShK128VeynEcx,"Lazza, Laura Pausini",ZERI IN PIÙ (LOCURA) (feat. Laura Pausini),Universal Music Italia srL.,1,-1,14,364890,1,Italy
185,186,spotify:track:7Isi6whc5DD6A5wH5nqyUw,Mahmood,RA TA TA,Universal Music Italia srL.,11,157,29,364097,1,Italy
186,187,spotify:track:1oBM9JTuD0wqfVQ8iuLjLQ,"Artie 5ive, Ddusi, Sadturs, KIID",64 BARRE IN FACCIA (Red Bull 64 Bars),Warner Music,45,70,18,362743,1,Italy
187,188,spotify:track:17phhZDn6oGtzMe56NuWvj,Teddy Swims,Lose Control,Warner Records,78,-1,42,360898,1,Italy
188,189,spotify:track:1w91YxaRwTShkKe4apYf3r,"Marracash, Guè",Insta Lova,Universal Music Italia srL.,1,193,87,357613,1,Italy
189,190,spotify:track:1k98jczpVBUfMYrl17atud,"Lazza, Kid Yugi",MEZZE VERITÀ (feat. Kid Yugi),Universal Music Italia srL.,9,-1,12,357595,1,Italy
190,191,spotify:track:7Da5kjy5GByLHE5OPQ4tpg,"Geolier, Marracash",IL MALE CHE MI FAI (feat. Marracash),Columbia,1,-1,83,357477,1,Italy
191,192,spotify:track:22skzmqfdWrjJylampe0kt,"Macklemore, Ryan Lewis, Macklemore & Ryan Lewis, Ray Dalton",Can't Hold Us (feat. Ray Dalton),Macklemore,116,199,91,357214,1,Italy
192,193,spotify:track:2zASmTrt3BKblrAwVfcqfZ,"Kid Yugi, Glocky",Diablo (feat. Glocky),Universal Music Italia srL.,16,-1,6,356801,1,Italy
193,194,spotify:track:2tTmW7RDtMQtBk7m2rYeSw,"Bizarrap, Quevedo","Quevedo: Bzrp Music Sessions, Vol. 52",DALE PLAY Records,1,160,122,352427,1,Italy
194,195,spotify:track:6KfwIpX0Xo0lelmuUOnyZV,"Elodie, Marracash",Margarita (con Marracash),Universal Music Italia srL.,7,-1,72,352265,1,Italy
195,196,spotify:track:2D70Rxq21tVlTJwtugZ4CA,"thasup, Mara Sattei",BLESS SU BLESS,Thasup s.r.l.,39,118,4,351877,1,Italy
196,197,spotify:track:30dke5FBGFpC1mcIz4RJnA,Francesco Gabbani,Viceversa,BMG Rights Management Italy S.R.L.,4,-1,34,349577,1,Italy
197,198,spotify:track:0rDIjhe1IQJhh3oPDxZJMg,Pinguini Tattici Nucleari,Your Dog,Epic,41,152,5,349309,1,Italy
198,199,spotify:track:5fBhangmT51wT6SARWf8FJ,"Olly, Juli",A squarciagola,Epic,89,-1,5,349082,1,Italy
199,200,spotify:track:0xGQTpN4ESETtl1Sp6rzd2,"The Weeknd, Anitta",São Paulo (feat. Anitta),XO / Republic Records,33,-1,5,348401,1,Italy
0,1,spotify:track:3sK8wGT43QFpWrvNQsrQya,Bad Bunny,DtMF,Rimas Entertainment LLC.,1,-1,1,2784854,2,Italy
1,2,spotify:track:4GkgNC3bpLqXyuxWvlNfKI,"Guè, Rose Villain",Oh Mamma Mia (feat. Rose Villain),Universal Music Italia srL.,2,-1,1,2660499,2,Italy
2,3,spotify:track:6Ajvu1afirjocbZK934qqh,"Simba La Rue, Tony Boy, FT Kings",AYAHUASCA (feat. Tony Boy),Warner Music,1,1,2,2564674,2,Italy
