,rank,uri,artist_names,track_name,source,peak_rank,previous_rank,weeks_on_chart,streams,week,country
24,25,spotify:track:5stOy3oDM1OahBHWHHBOF4,Willie Peyote,Grazie ma no grazie,Universal Music Italia srL.,15,17,4,1482194,9,Italy
25,26,spotify:track:5MJc4IVIt17xEt6angtZcq,Lazza,BUIO DAVANTI,Universal Music Italia srL.,3,27,24,1479343,9,Italy
26,27,spotify:track:6cGhVnQAJRxGVsltCU06vF,Guè,Vibe,Universal Music Italia srL.,4,36,8,1369402,9,Italy
27,28,spotify:track:420QMNPnHsbAqkkxBt2ifJ,"RRARI DAL TACCO, Kid Yugi",BIANCA (feat. Kid Yugi),Universal Music Italia srL.,1,33,6,1335240,9,Italy
28,29,spotify:track:75Y6WgUldQN8mipAVLy8KJ,"Olly, Juli",Quei ricordi là,Epic,15,24,19,1256840,9,Italy
29,30,spotify:track:2gI2IA7QGtzKZKuahon3W1,Achille Lauro,Amore Disperato,Warner Music,5,31,24,1249881,9,Italy
30,31,spotify:track:1QcmAp6Ev2HuYxKujUwnw0,Alfa,il filo rosso,Artist First,2,40,20,1197472,9,Italy
31,32,spotify:track:1CGqE43Inhm54oPCMrgF7S,SETTEMBRE,VERTEBRE,Isola degli Artisti,22,25,14,1194427,9,Italy
32,33,spotify:track:3BJ5P3bL0Q8OUemXVwjucQ,Rocco Hunt,MILLE VOTE ANCORA,Epic,24,32,4,1187852,9,Italy
33,34,spotify:track:4MtjrbmBKdYRMTyEHqOUmM,Marracash,GLI SBANDATI HANNO PERSO,Universal Music Italia srL.,2,39,12,1185090,9,Italy
34,35,spotify:track:41lOxc6ARYZPXpKeMWcHsD,Pinguini Tattici Nucleari,Islanda,Epic,1,45,16,1168896,9,Italy
35,36,spotify:track:2qgKFtVm0Ls6WC72sm9ELe,"Fedez, Marco Masini, FT Kings",BELLA STRONZA,Warner Music,26,26,3,1166195,9,Italy
36,37,spotify:track:5IYSfCt4m9WX4LKNRl2ia9,Joan Thiele,Eco,RCA Numero Uno,31,34,4,1117802,9,Italy
37,38,spotify:track:5pYy054Wcuj9CFdDIxZSVU,"Olly, Juli",Menomale che c'è il mare,Epic,38,42,28,1102586,9,Italy
38,39,spotify:track:2UcDX4rO9NITHO9ted6KUL,Modà,Non ti dimentico,Warner Music,26,30,4,1087749,9,Italy
39,40,spotify:track:2DkiFEQ1ihXcYKaIRsfGFp,Marracash,LEI,Universal Music Italia srL.,1,47,12,1052381,9,Italy
40,41,spotify:track:2no1HLYjXuCpr4Gf4XVhXg,CLARA,FEBBRE,Warner Music,28,35,4,1050023,9,Italy
41,42,spotify:track:3fbwo3003OZitzByA6ppPP,Francesco Gabbani,Viva la vita,BMG Rights Management Italy S.R.L.,30,37,4,1046120,9,Italy
42,43,spotify:track:5TFD2bmFKGhoCRbX61nXY5,Bad Bunny,NUEVAYoL,Rimas Entertainment LLC.,3,49,9,1045662,9,Italy
43,44,spotify:track:0h3w9Sr1gToqxA9gIs5O39,Gabry Ponte,Tutta L'Italia,Warner Music,41,41,3,996083,9,Italy
44,45,spotify:track:3w73qvCSGWPCx7w1UMIh6e,Capo Plaza,Lo So Che,Warner Music,34,48,15,976611,9,Italy
45,46,spotify:track:00URgxWgyVoybGLhhmKr7g,"Baby Gang, Omega, Higashi, Roberto Ferrante",Tu Me Quieres - Prod. by Higashi x Roberto Ferrante,Baby Gang / Planet Records [Powered by Planet Distribution],10,50,25,953017,9,Italy
46,47,spotify:track:7Co4JFHHRVoAf9lCx37aGx,Francesca Michielin,Fango in Paradiso,Columbia,25,38,4,908249,9,Italy
47,48,spotify:track:4GkgNC3bpLqXyuxWvlNfKI,"Guè, Rose Villain",Oh Mamma Mia (feat. Rose Villain),Universal Music Italia srL.,2,55,8,890413,9,Italy
48,49,spotify:track:1nLGeFQuY7PFxrou3ezEvP,Sal Da Vinci,Rossetto e caffè,Cose Production srl,10,70,34,867952,9,Italy
49,50,spotify:track:62OO2X47vPk5WxTx68HDqg,"Artie 5ive, Niky Savage",BAMBOLA (feat. Niky Savage),Warner Music,2,46,12,838808,9,Italy
50,51,spotify:track:7LjhTVncMxoH9X6KMWECgq,"Papa V, Nerissima Serpe, Shiva, Night Skinny, Fritu",Wop Wop (feat. Shiva),UNIKAL,2,54,7,820747,9,Italy
51,52,spotify:track:6WatFBLVB0x077xWeoVc2k,KAROL G,Si Antes Te Hubiera Conocido,Bichota/Interscope Records,5,60,36,820211,9,Italy
52,53,spotify:track:4wJ5Qq0jBN4ajy7ouZIV1c,"ROSÉ, Bruno Mars",APT.,Atlantic Records,12,57,20,805549,9,Italy
53,54,spotify:track:5wxGfq3mQTlvYpON9F2wSu,"SLF, MV Killa, Yung Snapp, Lele Blade, Vale Lambo, Frezza","PEZZI DA NOVANTA (feat. MV Killa, Yung Snapp, Lele Blade, Vale Lambo, Frezza)",Warner Music,29,52,6,797957,9,Italy
54,55,spotify:track:62UEDjQEgBx7GDKDiSoz3i,Tananai,BOOSTER,Universal Music Italia srL.,44,56,17,789702,9,Italy
55,56,spotify:track:7nRFsITVaSHko2Fw2Gcy59,Gazzelle,Destri,Artist First / Maciste Dischi,2,145,232,780194,9,Italy
56,57,spotify:track:59D4DOkspUbWyMmbAPQkxZ,Bad Bunny,VOY A LLeVARTE PA PR,Rimas Entertainment LLC.,23,68,8,768584,9,Italy
57,58,spotify:track:1RZQfURtYA7RYzontyWTI5,"Guè, Artie 5ive",Akrapovič (feat. Artie 5ive),Universal Music Italia srL.,4,65,8,763146,9,Italy
58,59,spotify:track:2plbrEY59IikOBgBGLjaoe,"Lady Gaga, Bruno Mars",Die With A Smile,Interscope,20,61,29,756866,9,Italy
59,60,spotify:track:2z9FUHRkbkV4BObNzbHsFU,Damiano David,Born With a Broken Heart,Sony Music Italy / Arista Records,31,67,19,745919,9,Italy
60,61,spotify:track:0tNVbYUSaIAueDcwd2Pobz,Simone Cristicchi,Quando sarai piccola,Dueffel Music,20,43,4,737317,9,Italy
61,62,spotify:track:7BeZyW4hVjeCocSLwDrCME,"Geolier, Michelangelo","I P’ ME, TU P’ TE",Warner Music,1,73,57,737131,9,Italy
62,63,spotify:track:6Ajvu1afirjocbZK934qqh,"Simba La Rue, Tony Boy, FT Kings",AYAHUASCA (feat. Tony Boy),Warner Music,1,74,9,726776,9,Italy
63,64,spotify:track:7ne4VBA60CxGM75vw0EYad,Gracie Abrams,That’s So True,"Gracie Abrams, under exclusive license to Interscope Records",23,66,17,723806,9,Italy
64,65,spotify:track:5aKUmqW53tAZ2aslu5gV6l,"Flaco G, Shiva",GDE WOW (feat. Shiva),Warner Music,65,-1,1,702080,9,Italy
65,66,spotify:track:5eSC7faDYHxnklPjcxZjD6,Marracash,BRAVI A CADERE - I polmoni,Universal Music Italia srL.,8,69,99,699548,9,Italy
66,67,spotify:track:3EJSUFQGUaTm4Km2Zri1Zp,"Juli, Emma, Olly",HO VOGLIA DI TE,Universal Music Italia srL.,15,53,38,698461,9,Italy
67,68,spotify:track:5niBKNtMNJTSPLTCBTc3wr,Jovanotti,Un mondo a parte,Universal Music Italia srL.,68,77,3,695827,9,Italy
68,69,spotify:track:5ZLUm9eab8y3tqQ1OhQSHI,Lady Gaga,Abracadabra,Interscope Records,33,72,5,652258,9,Italy
69,70,spotify:track:6AI3ezQ4o3HUoP6Dhudph3,Kendrick Lamar,Not Like Us,"Kendrick Lamar, under exclusive license to Interscope Records",50,62,18,644438,9,Italy
70,71,spotify:track:4ySxBjhmdnkeFUqhKxW3cY,Sfera Ebbasta,Visiera A Becco,Universal Music Italia srL.,43,95,213,639796,9,Italy
71,72,spotify:track:1j58NLQYaQsLW1eYppRI02,Lucio Corsi,Tu sei il mattino,Universal Music Italia srL. (Sugar),44,44,3,639301,9,Italy
72,73,spotify:track:7sj9VfVtmcEZBDbRAsVXWY,"ANNA, Niky Savage",TT LE GIRLZ (feat. Niky Savage),Universal Music Italia srL.,1,86,36,633680,9,Italy
73,74,spotify:track:1aT87zstUEwwv62feXL6Gi,Marcella Bella,Pelle diamante,BMG Rights Management Italy S.R.L.,35,51,4,628010,9,Italy
74,75,spotify:track:3qtuOAI0YyfoBM1s7Tvm46,Cesare Cremonini,La Nuova Stella Di Broadway,Universal Music Italia srL.,68,83,93,626790,9,Italy
75,76,spotify:track:42wdz3j7gstgUuhoFLCXqd,FloyyMenor,PELIGROSA,FloyyMenor under exclusive license to UnitedMasters LLC,41,91,28,621767,9,Italy
76,77,spotify:track:3OewdIjWctx4TH6jswXRrc,Pinguini Tattici Nucleari,Amaro,Epic,11,82,13,616340,9,Italy
77,78,spotify:track:3XOcMFFT6Oo2ZCXLJ9lqdT,"Geolier, Rose Villain, Poison Beatz",TU ED IO (feat. Rose Villain),Warner Music,8,75,15,608579,9,Italy
78,79,spotify:track:2lTm559tuIvatlT1u0JYG2,Bad Bunny,BAILE INoLVIDABLE,Rimas Entertainment LLC.,21,89,8,605501,9,Italy
79,80,spotify:track:7kktKNHgINrBczPUGoG38p,Sfera Ebbasta,Bang Bang,Universal Music Italia srL.,57,90,138,603336,9,Italy
80,81,spotify:track:1u9C89v58yfZkMgFe7rBS1,"Papa V, Nerissima Serpe, Fritu",Tip Tap,UNIKAL,3,81,14,599828,9,Italy
81,82,spotify:track:35ISBknsCeZQtq66xABI9g,Lola Young,Messy,Universal-Island Records Ltd.,51,98,9,598340,9,Italy
82,83,spotify:track:4z9xPVz2Sii4dhM7yhxOpj,"Geolier, Sfera Ebbasta, Dardust",IO T’O GIUR’ (feat. Sfera Ebbasta),Warner Music,7,126,38,596125,9,Italy
83,84,spotify:track:69VAE3LA7jn5rGAsdflMOS,"Geolier, Poison Beatz",EL PIBE DE ORO,Warner Music,5,94,43,595073,9,Italy
84,85,spotify:track:0CCWIksRK4Q3um834dNG3a,Pinguini Tattici Nucleari,Romantico Ma Muori,Epic,7,96,25,589511,9,Italy
85,86,spotify:track:6uFaYYmb5ngSlqLNxsBMzs,"Simba La Rue, FT Kings",CAZZI MIEI,Warner Music,20,64,5,587882,9,Italy
86,87,spotify:track:1IkzT4wzFJRbFOmKOSqTen,"Geolier, Takagi & Ketra, Dat Boi Dee",EPISODIO D'AMORE,Warner Music,7,59,39,585363,9,Italy
87,88,spotify:track:2l4NKSQbBA3sV0nxpNjSkj,Lazza,100 MESSAGGI,Universal Music Italia srL.,1,78,54,583976,9,Italy
88,89,spotify:track:30yZdVYOfemHG7uuntz7HH,ANNA,TONIGHT,Universal Music Italia srL.,30,103,36,573227,9,Italy
89,90,spotify:track:2oDlAuhJExJd7papr3cyBF,Capo Plaza,Sottovuoto,Warner Music,10,110,13,572879,9,Italy
90,91,spotify:track:4ZRVI6xwgbjgW5SgJB468n,"ANNA, Artie 5ive",I LOVE IT (feat. Artie 5ive),Universal Music Italia srL.,3,100,36,572378,9,Italy
91,92,spotify:track:2esZG2XFtuoWWA9AfDvSxy,"FloyyMenor, Cris Mj",Gata Only,FloyyMenor under exclusive license to UnitedMasters LLC,2,111,52,568479,9,Italy
92,93,spotify:track:19DHPlTC2gx1j4jrFzNbwL,ANNA,30ºC,Universal Music Italia srL.,1,106,40,568439,9,Italy
93,94,spotify:track:6xZCDUaY4XzlhCSHKSW7rf,Damiano David,Next Summer,Sony Music Italy / Arista Records,94,-1,1,567294,9,Italy
94,95,spotify:track:5p319BfcZtPd7Y8FOGB3yH,Gazzelle,Grattacieli meteoriti gli angeli,Warner Music,24,140,6,566625,9,Italy
95,96,spotify:track:1GVDt0vn0wJ1QemPfMEWTU,Ghali,Niente Panico,Warner Music,16,58,21,566394,9,Italy
96,97,spotify:track:7fH13hSOyNoeiDGbjEnTUC,"Guè, Marracash",Brivido,Universal Music Italia srL.,67,108,259,563716,9,Italy
97,98,spotify:track:5IVog5NE9Ccw4cLrOqXSUG,"Paky, Simba La Rue",Gangsta Shit (feat. Simba La Rue),Warner Music,10,76,7,561286,9,Italy
98,99,spotify:track:0xEgDBXYO9gGzmxCFWKxNg,Marracash,CRUDELIA - I nervi,Universal Music Italia srL.,2,101,268,551040,9,Italy
99,100,spotify:track:5EPfp1edrw1vgxriqxLTlD,RRARI DAL TACCO,CAFFÈ AMARO,Universal Music Italia srL.,36,87,13,549958,9,Italy
100,101,spotify:track:3pR6j5Zhl7Qbrv4lh3DTG5,"Tony Effe, Gaia",SESSO E SAMBA (feat. Gaia),Universal Music Italia srL.,1,92,41,546235,9,Italy
101,102,spotify:track:3yFgWoossjlaJ919XDCG4C,"Simba La Rue, FT Kings, Sick Luke",MI PIACCIONO LE ARMI,Warner Music,1,93,20,545552,9,Italy
102,103,spotify:track:2toyDDWentmjZTyojLVXfP,"Olly, Juli",I cantieri del Giappone,Epic,69,71,11,545421,9,Italy
103,104,spotify:track:5EeDZPNPIjEtEZsHMkX1m7,Kid Yugi,Donna,Universal Music Italia srL.,3,104,19,536447,9,Italy
104,105,spotify:track:3xkHsmpQCBMytMJNiDf3Ii,Benson Boone,Beautiful Things,"Night Street Records, Inc./Warner Records Inc.",19,124,56,525494,9,Italy
105,106,spotify:track:6MQYhSIrh9vwztmM6mwkzQ,"Kid Yugi, Night Skinny, Artie 5ive",Porto il Commerciale (feat. Artie 5ive),Universal Music Italia srL.,35,118,48,516526,9,Italy
106,107,spotify:track:3bXpBkWuxmutEWvTqAIdaz,Coma_Cose,POSTI VUOTI,Warner Music,95,102,12,515263,9,Italy
107,108,spotify:track:7jfthjlyognNdV2geSbtsE,Capo Plaza,Borse Hermès,Warner Music,46,112,19,513866,9,Italy
108,109,spotify:track:5fBhangmT51wT6SARWf8FJ,"Olly, Juli",A squarciagola,Epic,76,80,8,513328,9,Italy
109,110,spotify:track:5z1XCZMzScqeqCe4iUh3WA,Tony Boy,Tutti i giorni,Warner Music,24,105,11,512300,9,Italy
110,111,spotify:track:6YB8rH5Lr340A4ps8eV7hw,Kid Yugi,Lilith,Universal Music Italia srL.,8,123,53,505461,9,Italy
111,112,spotify:track:6RJW9DiBr1RDjgT4GdCSp7,"Geolier, Dat Boi Dee, ROOM9","FERRARI (from ""Uonderbois"")",Warner Music,95,116,10,505452,9,Italy
112,113,spotify:track:4M1YXSjzb3HHndhd9dUVSF,"Le-one, Christian Liguori",PARENTE,Epic,67,109,6,503684,9,Italy
113,114,spotify:track:11vx0NpOW2FonkLKg2ylLU,"Olly, Juli",Bianca,Epic,80,84,5,501733,9,Italy
114,115,spotify:track:6dOtVTDdiauQNBQEDOtlAB,Billie Eilish,BIRDS OF A FEATHER,Darkroom/Interscope Records,39,122,42,497318,9,Italy
115,116,spotify:track:50uGP4Bs22S1iPNn1hTo3R,"Papa V, Nerissima Serpe, Fritu",A Lei,UNIKAL,11,88,7,496983,9,Italy
116,117,spotify:track:3GCdLUSnKSMJhs4Tj6CV3s,"Kendrick Lamar, SZA",All The Stars (with SZA),Black Panther (TDE/DMG) PS,32,99,37,496825,9,Italy
117,118,spotify:track:05wb6MEyJeG2z1MVCIXxC8,"Sfera Ebbasta, Marracash",15 Piani,Universal Music Italia srL.,1,138,68,496724,9,Italy
118,119,spotify:track:0M6Rh4nTaxVJefzV9IAVFq,"Guè, Stadio",Meravigliosa (feat. Stadio),Universal Music Italia srL.,6,132,8,492916,9,Italy
119,120,spotify:track:4Y60H8heDsEpQ2hin2g6V5,Don Pero,Baby Mama,Pulp Entertainment,22,153,106,482507,9,Italy
120,121,spotify:track:5omIW7YOPhA6CULhkdz6jE,"Tedua, Baby Gang, Kid Yugi",Paradiso Artificiale (feat. Baby Gang & Kid Yugi),Epic,2,137,92,480554,9,Italy
121,122,spotify:track:0HiHVL8iC1Z1kAjV6vZdIo,"Tony Boy, Frah Quintale, Capo Plaza","Non mi basta mai (feat. Frah Quintale, Capo Plaza)",Warner Music,13,119,13,476571,9,Italy
122,123,spotify:track:07qo9gnLM488CUr0EtgIA1,Cesare Cremonini,Poetica,Universal Music Italia srL.,15,142,64,473980,9,Italy
123,124,spotify:track:44tBffPLYUMKzZrKXXRaKn,"Bresh, Cristiano De André",Crêuza de mä - live version,Epic,63,63,2,473308,9,Italy
124,125,spotify:track:7tI8dRuH2Yc6RuoTjxo4dU,Jimin,Who,BIGHIT MUSIC,92,127,32,472111,9,Italy
125,126,spotify:track:0lXVWzLwDnKB7Ro5p0AJPg,"Rose Villain, Guè",COME UN TUONO (feat. Guè),Warner Music,1,133,52,470107,9,Italy
126,127,spotify:track:3cGuiySfwJPXqvE15OiEEg,Sfera Ebbasta,Tran Tran,Universal Music Italia srL.,1,166,174,467935,9,Italy
127,128,spotify:track:2Om8fOpJjFtSn7MGdj3aen,Elisa,Dillo Solo Al Buio,Universal Music Italia srL.,89,129,8,466223,9,Italy
128,129,spotify:track:6bN41HjY008ggroMFxNLaa,"Sfera Ebbasta, Geolier, Simba La Rue, Baby Gang",Calcolatrici,Universal Music Italia srL.,1,141,68,465925,9,Italy
129,130,spotify:track:5mOazYGaNJnv1zxMyNH6Rc,"Guè, chiello",Non Lo So (feat. chiello),Universal Music Italia srL.,16,115,8,465526,9,Italy
130,131,spotify:track:1yZIX0bRGjVH6CqyUW8Dkw,"Tananai, Annalisa",STORIE BREVI,Universal Music Italia srL.,5,128,39,464698,9,Italy
131,132,spotify:track:2ceJa7d62wQ3eRBK589ALG,"Shiva, Kid Yugi",Gotham (feat. Kid Yugi),Milano Ovest,2,135,26,463178,9,Italy
132,133,spotify:track:3FjK86616FbluOfTxNK2gY,"Sleepy Hallow, Doechii",ANXIETY (feat. Doechii),Winners Circle/RCA Records,133,-1,1,463100,9,Italy
133,134,spotify:track:2vAzyP21f777MdZNcyt6yt,"Fedez, Noemi",L'amore eternit,Newtopia,84,120,8,461371,9,Italy
134,135,spotify:track:22skzmqfdWrjJylampe0kt,"Macklemore, Ryan Lewis, Macklemore & Ryan Lewis, Ray Dalton",Can't Hold Us (feat. Ray Dalton),Macklemore,116,179,94,456252,9,Italy
135,136,spotify:track:3qxiSQOe8EhQm7OckqKiUu,"Tony Effe, Bresh, Tedua",DOPO LE 4 (feat. Bresh & Tedua),Universal Music Italia srL.,1,131,51,451966,9,Italy
136,137,spotify:track:0FIDCNYYjNvPVimz5icugS,"The Weeknd, Playboi Carti",Timeless (feat Playboi Carti),XO / Republic Records,39,134,23,449393,9,Italy
137,138,spotify:track:2YdOZTN2ElEYhEuq6zmwT8,Gazzelle,Non sei tu,Maciste Dischi,131,178,50,448583,9,Italy
138,139,spotify:track:2kZV7d0A4BIN5I8iFBnbqp,"Achille Lauro, Gow Tribe",16 Marzo (feat. Gow Tribe),Elektra/WM Italy,28,143,39,448508,9,Italy
139,140,spotify:track:29nqe5lhK8JmNcVXum7UuA,"Kid Yugi, Tedua, Junior K",Eva (feat. Tedua),Universal Music Italia srL.,3,150,53,446087,9,Italy
140,141,spotify:track:6d9eOuVkzV4XJ8YIWM3Q1k,"Tony Effe, Kid Yugi, Sick Luke",PEZZI DA 100 (feat. Kid Yugi),Universal Music Italia srL.,22,114,13,443781,9,Italy
141,142,spotify:track:1zp4TEQ9zaNGXTjY6fsz1p,"Capo Plaza, ANNA",Soldi Arrotolati (feat. ANNA),Warner Music,5,97,44,439295,9,Italy
142,143,spotify:track:3X5Zw8zkIGULZEnJUwwJwj,Glocky,Problem Solver,Square,77,157,10,438064,9,Italy
143,144,spotify:track:5qLvcq1BMgwj5jMKuIYRGQ,"MamboLosco, Low-Red",HARDER (feat. Low-Red),Warner Music,121,121,4,435083,9,Italy
144,145,spotify:track:1LcAwUvsiWJqTgV9vDs0oq,"Kid Yugi, Sfera Ebbasta, Shablo",Ex Angelo (feat. Sfera Ebbasta),Universal Music Italia srL.,10,156,48,432597,9,Italy
145,146,spotify:track:5WssaPhjCCUFBMk9PpnHYj,"Sfera Ebbasta, Elodie",Anche Stasera,Universal Music Italia srL.,5,186,64,431553,9,Italy
146,147,spotify:track:0mEyPi2ya8h8632gp9XmmQ,"Night Skinny, Tony Boy, Kid Yugi, Capo Plaza","Entro nel posto (feat. Tony Boy, Kid Yugi & Capo Plaza)",Universal Music Italia srL.,1,159,21,425787,9,Italy
147,148,spotify:track:0MLu1cFYL4ikdRTdasCQT9,"Shablo, Geolier, Sfera Ebbasta",M' Manc (con Geolier & Sfera Ebbasta),Universal Music Italia srL.,1,136,196,424574,9,Italy
148,149,spotify:track:4CQNELF3U3gyNcI6sLr6yK,"Bresh, SHUNE",Guasto D'Amore,Epic,2,117,97,419674,9,Italy
149,150,spotify:track:5HWWpSsNnlc2Kyh5QLrq1W,Tananai,RAGNI,Universal Music Italia srL.,16,146,26,419298,9,Italy
150,151,spotify:track:50okpBf3MvXr4FyWB6jJIK,Bresh,Torcida,Epic,12,139,41,415853,9,Italy
151,152,spotify:track:74cyFjvgjyiFiQ3QxszFWq,Tananai,TANGO,Universal Music Italia srL.,3,177,106,412913,9,Italy
152,153,spotify:track:4DnrAI8WyUY6gkOwl8GlPN,"Alleh, Yorghaki",capaz (merengueton),CONMUER LLC,110,176,8,411616,9,Italy
153,154,spotify:track:1HCwbTHBvC4XCIC417NB5k,Rose Villain,CLICK BOOM!,Warner Music,7,164,57,411191,9,Italy
154,155,spotify:track:3KqIOF2HTFEwz0HmErwOYG,"Lazza, Sfera Ebbasta",FENTANYL (feat. Sfera Ebbasta),Universal Music Italia srL.,1,172,23,408727,9,Italy
155,156,spotify:track:6hBvXhUosokAqnc701pVE1,Marracash,È FINITA LA PACE,Universal Music Italia srL.,3,163,12,404949,9,Italy
156,157,spotify:track:1w91YxaRwTShkKe4apYf3r,"Marracash, Guè",Insta Lova,Universal Music Italia srL.,1,-1,89,404463,9,Italy
157,158,spotify:track:3gWBWLw3J3XTy3QTo36GqJ,Tommy Cash,Espresso Macchiato,Epic,125,125,2,403892,9,Italy
158,159,spotify:track:4I2SWtTgB08SICbqN6983B,"ANNA, Lazza",BBE (feat. Lazza),Universal Music Italia srL.,4,173,43,403852,9,Italy
159,160,spotify:track:1m69ELEgE6k5ZWsap40ozt,Ozuna,Se Preparó,VP Records Corp/Dimelo Vi,91,-1,26,399787,9,Italy
160,161,spotify:track:7115pIZRP1L0MaJCPFPPFM,Tony Boy,Come mi guardi,Gorilla Records,102,174,25,396443,9,Italy
161,162,spotify:track:2tTmW7RDtMQtBk7m2rYeSw,"Bizarrap, Quevedo","Quevedo: Bzrp Music Sessions, Vol. 52",DALE PLAY Records,1,-1,125,394802,9,Italy
162,163,spotify:track:55aJJZPGLrIjI0nYYb7Bul,"Lazza, Lil Baby",CANZONE D'ODIO (feat. Lil Baby),Universal Music Italia srL.,1,165,24,393034,9,Italy
163,164,spotify:track:1Nxi3qWX2wJ08VeWiSV9By,Alex Wyse,Rockstar,Artist First,41,85,4,388140,9,Italy
164,165,spotify:track:2262bWmqomIaJXwCRHr13j,Gigi Perez,Sailor Song,Gigi Perez PS/ Island,81,184,21,386322,9,Italy
165,166,spotify:track:0wTUTktrrCdXAzPVlodP72,Capo Plaza,Acqua Passata,Warner Music,12,199,30,384694,9,Italy
166,167,spotify:track:5Z0Mx6SeUAFA2rgZB9t1Nu,Sfera Ebbasta,Serpenti A Sonagli,Universal Music Italia srL.,5,-1,70,383426,9,Italy
167,168,spotify:track:7uu3YZytpYW15VIfa7ynJk,"Marracash, Federica Abbate",Niente Canzoni D'Amore - Inedito,Universal Music Italia srL.,137,195,29,383269,9,Italy
168,169,spotify:track:6JjPBQfI2Y8nIjnm65X6Pw,"Nicky Jam, J Balvin, Maluma, Ozuna",X (feat. Maluma & Ozuna) - Remix,Sony Music Latin,90,-1,12,381272,9,Italy
169,170,spotify:track:5oJVfPUHsD7A8bZtKVqgL2,"Geolier, Ultimo, Takagi & Ketra",L'ULTIMA POESIA (feat. Ultimo),Warner Music,2,191,50,380941,9,Italy
170,171,spotify:track:3AWDeHLc88XogCaCnZQLVI,The Weeknd,Cry For Me,XO / Republic Records,21,154,5,380470,9,Italy
171,172,spotify:track:0bKDQionn4VKcgNKbs4SWX,Pinguini Tattici Nucleari,Pastello Bianco,RCA Records Label,2,-1,144,379339,9,Italy
172,173,spotify:track:2xjxaKiYssIdDU6DCPpZPt,Dark Polo Gang,Cambiare Adesso,Universal Music Italia srL.,1,168,75,379055,9,Italy
173,174,spotify:track:0aB0v4027ukVziUGwVGYpG,"Kendrick Lamar, Lefty Gunplay",tv off (feat. lefty gunplay),"pgLang, under exclusive license to Interscope Records",77,149,6,378023,9,Italy
174,175,spotify:track:7DY756WOLyOz2Xnhw4EFiC,"The Weeknd, Anitta",São Paulo (feat. Anitta),XO / Republic Records,33,167,11,377332,9,Italy
175,176,spotify:track:2CGNAOSuO1MEFCbBRgUzjd,"Kendrick Lamar, SZA",luther (with sza),"pgLang, under exclusive license to Interscope Records",83,158,6,375506,9,Italy
176,177,spotify:track:5LZVK19ieaV8Mk9FsqTL3F,Pinguini Tattici Nucleari,Ridere,RCA Records Label,31,196,254,374998,9,Italy
177,178,spotify:track:5nqOdSrqurNq8ejE7Ujc9l,Kid Yugi,Il Filmografo,Universal Music Italia srL.,97,183,40,373950,9,Italy
178,179,spotify:track:0GFkLnsRGqtkd23dFWpoI0,"Lele Blade, Geolier, Dele, Poison Beatz",HEETS (feat. Geolier),Warner Music,5,181,19,372370,9,Italy
179,180,spotify:track:0Sr7ssScx54yxdM2ols7nW,"Omar Courtz, De La Rose",Q U E V A S H A C E R H O Y ?,Mr. 305 Records / Rimas Entertainment,94,-1,19,371864,9,Italy
180,181,spotify:track:3ppXueOTvYpYp7zQUbuIKh,"Shiva, Tony Boy",Polvere (feat. Tony Boy),Milano Ovest,9,185,26,370200,9,Italy
181,182,spotify:track:1JSTJqkT5qHq8MDJnJbRE1,The Police,Every Breath You Take,Polydor Records,120,190,15,369831,9,Italy
182,183,spotify:track:0kHTkvGavvk2MjBTSUtOZx,Sfera Ebbasta,Ricchi x Sempre,Universal Music Italia srL.,4,-1,71,368958,9,Italy
183,184,spotify:track:7KTseTI8UdMT4WUIOmjTQC,"TY1, Kid Yugi, Nerissima Serpe","MONOPOLIO (feat. Kid Yugi, Nerissima Serpe)",Thaurus,85,198,57,368320,9,Italy
184,185,spotify:track:5zVQoMHyELfcHYviXDao3I,"Artie 5ive, Guè",MILANO TESTAROSSA (feat. Guè),Warner Music,23,-1,26,368092,9,Italy
185,186,spotify:track:4elAiEgBssziHLfCrBoEA2,"Cesare Cremonini, Luca Carboni",San Luca (feat. Luca Carboni),Universal Music Italia srL.,54,155,14,367512,9,Italy
186,187,spotify:track:7KI9vyPycMZ0Noh51ylQ9W,"Night Skinny, Artie 5ive, Capo Plaza, Tony Effe","Nella trap (feat. Artie 5ive, Capo Plaza & Tony Effe)",Universal Music Italia srL.,6,169,21,366146,9,Italy
187,188,spotify:track:1BJJbSX6muJVF2AK7uH1x4,"Adam Port, Stryv, Keinemusik, Orso, Malachiii",Move,Keinemusik,18,-1,36,365582,9,Italy
188,189,spotify:track:5LDmD4cFF0C8BCf3tVvyBW,"Tedua, Annalisa",Beatrice (feat. Annalisa),Epic,1,188,41,361898,9,Italy
189,190,spotify:track:1tIGa9fXqu3T3AikU5G8Ds,"Geolier, Michelangelo",PER SEMPRE,Warner Music,26,147,39,361434,9,Italy
190,191,spotify:track:2wpSLqGcN5KXVeAGdAnQd0,"Ornella Vanoni, Jack Sani",Sant'allegria - Jack Sani Remix,NAR International,34,193,27,360139,9,Italy
191,192,spotify:track:6OCnAtM8oa0JymErlTYXxG,"Astro, ANNA",1 MOMENTO (feat. ANNA),Warner Music,6,-1,21,359091,9,Italy
192,193,spotify:track:0mHC3BK9vFGoEU0EcGPWRZ,Lazza,CENERE,Universal Music Italia srL.,1,187,98,359017,9,Italy
193,194,spotify:track:6sLBJkMyZIkGevtpYgeotT,Ultimo,Piccola Stella,Honiro distribuito da Believe Distribution Services,15,-1,151,358659,9,Italy
194,195,spotify:track:3NLdcu14EPntcZIn3mxSR7,"Kid Yugi, Night Skinny, Tony Boy",Sintetico (feat. Tony Boy),Universal Music Italia srL.,76,194,72,358574,9,Italy
195,196,spotify:track:6jPnupVIj7ELwbGne3js7f,"Escomar, FT Kings, Simba La Rue",Madama (feat. Simba La Rue),Warner Music,102,151,4,357700,9,Italy
196,197,spotify:track:5ODlTG5qxhCsC05E36Rv25,"Guè, Frah Quintale",2% (feat. Frah Quintale),Universal Music Italia srL.,4,-1,71,355466,9,Italy
197,198,spotify:track:59ToSWwKmlwI6TIgZkw60M,"Melons, Ddusi",Stellina,Epic,198,-1,1,354475,9,Italy
198,199,spotify:track:4KNumtDS7aWRwDZDmWJ2lN,Modà,Quel sorriso in volto,Believe Distribution Services,199,-1,1,350839,9,Italy
199,200,spotify:track:13BIz3zYk4SZlSckndvDKF,Gazzelle,Noi no,Warner Music,36,-1,7,350790,9,Italy
0,1,spotify:track:5pNm9cYzWaAtoihxILG3cw,"Olly, Juli",Balorda nostalgia,Epic,1,1,5,4929532,10,Italy
1,2,spotify:track:5tOBPD3zL9kWpeELqkzwJC,Giorgia,LA CURA PER ME,Epic,2,3,5,3372170,10,Italy
2,3,spotify:track:6bfy5e5jWNcNSFAJzsMPED,Fedez,BATTITO,Warner Music,2,2,5,3257513,10,Italy
3,4,spotify:track:25VdEndwyUDs0DbpfCMfKD,Achille Lauro,Incoscienti Giovani,Warner Music,4,4,5,3163991,10,Italy
4,5,spotify:track:5sFbAYktReH4AJbATsGAw8,Lucio Corsi,Volevo essere un duro,Universal Music Italia srL. (Sugar),3,5,5,2581805,10,Italy
5,6,spotify:track:2C46EwfXY2ijlt7BfBY5mi,Rose Villain,fuorilegge,Warner Music,6,7,5,2462087,10,Italy
6,7,spotify:track:177cKZBT80QEPlrSS4nLw9,"Shablo, Guè, Joshua, Tormento","La Mia Parola (feat. Guè, Joshua, Tormento)",Universal Music Italia srL.,6,6,5,2406505,10,Italy
7,8,spotify:track:4RTMLSmkfK9kqKlmTPGRzo,Bresh,La tana del granchio,Epic,6,8,5,2231310,10,Italy
8,9,spotify:track:0fPhrbZJqHbmsuV2RQbeSB,Coma_Cose,CUORICINI,Warner Music,9,9,5,2117172,10,Italy
9,10,spotify:track:2BptnzpcLO9NAdNdKh2rZy,Rkomi,il ritmo delle cose.,Universal Music Italia srL.,10,10,5,1918674,10,Italy
10,11,spotify:track:06ZV0oxrmuVf6rThhGtxxy,The Kolors,TU CON CHI FAI L'AMORE,Warner Music,11,12,5,1842516,10,Italy
11,12,spotify:track:5M8Z823Sb2BhMpecHksN0T,Serena Brancale,ANEMA E CORE,Warner Music,11,11,5,1836865,10,Italy
12,13,spotify:track:2hOVaWpnPpTdqvaRTvI9L5,Gaia,CHIAMO IO CHIAMI TU,Columbia,13,13,5,1738979,10,Italy
13,14,spotify:track:5nFyfjGy6AMZqkW0OMUWJJ,"Olly, Angelina Mango, Juli",Per due come noi,Epic,1,21,27,1721960,10,Italy
14,15,spotify:track:4X4R6qsIicxIQIFbnDcJLO,"Olly, Juli",Scarabocchi,Epic,4,16,20,1586843,10,Italy
15,16,spotify:track:2L16IuIQgLL1HupWGN4F4t,Cesare Cremonini,Ora che non ho più te,Universal Music Italia srL.,1,22,25,1563940,10,Italy
16,17,spotify:track:6MlIhakM4I7fZa2iLpijrr,Noemi,Se t'innamori muori,Columbia,16,18,5,1512193,10,Italy
17,18,spotify:track:234fOFiPU3zFTgkPNg5nX5,Irama,Lentamente,Warner Music,14,15,5,1455067,10,Italy
18,19,spotify:track:5bArDgxe1cvT6GPTz9x07Y,Brunori Sas,L'albero delle noci,Universal Music Italia srL.,12,14,5,1448126,10,Italy
19,20,spotify:track:5MJc4IVIt17xEt6angtZcq,Lazza,BUIO DAVANTI,Universal Music Italia srL.,3,26,25,1422059,10,Italy
20,21,spotify:track:2WiYCsnOxE29r8Y8gV9aVA,Sarah Toscano,Amarcord,Warner Music,17,17,5,1415494,10,Italy
21,22,spotify:track:3sK8wGT43QFpWrvNQsrQya,Bad Bunny,DtMF,Rimas Entertainment LLC.,1,24,9,1379181,10,Italy
22,23,spotify:track:3W1xZMEfi44Wxts9HMBJJS,Elodie,Dimenticarsi alle 7,Universal Music Italia srL.,11,19,5,1355546,10,Italy
23,24,spotify:track:1ej2NcW0CHnscPp1RZpr1V,"Olly, Juli",Devastante,Epic,9,23,53,1355351,10,Italy
24,25,spotify:track:420QMNPnHsbAqkkxBt2ifJ,"RRARI DAL TACCO, Kid Yugi",BIANCA (feat. Kid Yugi),Universal Music Italia srL.,1,28,7,1291924,10,Italy
25,26,spotify:track:3hjG2x6wWyJ84ue7GESTVR,Tony Effe,DAMME 'NA MANO,Universal Music Italia srL.,3,20,5,1282801,10,Italy
26,27,spotify:track:6cGhVnQAJRxGVsltCU06vF,Guè,Vibe,Universal Music Italia srL.,4,27,9,1248503,10,Italy
27,28,spotify:track:41lOxc6ARYZPXpKeMWcHsD,Pinguini Tattici Nucleari,Islanda,Epic,1,35,17,1206393,10,Italy
